[
  {
    "schema_version": 2,
    "id": "he-hds-open-table",
    "mode": "workflow",
    "tags": [
      "hds",
      "view",
      "executable",
      "natural"
    ],
    "utterance": "show Meta institutional holders as a table",
    "resolved_entities": [
      {
        "spoken_name": "meta",
        "ticker": "META",
        "venue": "US",
        "asset_class": "EQ"
      }
    ],
    "scoring": {
      "strict_steps": true,
      "actions": "exact"
    },
    "expected": {
      "kind": "execute",
      "steps": [
        {
          "command": "HDS",
          "ticker": "META",
          "actions": [
            {
              "feature": "view",
              "operation": "select",
              "value": "Table"
            }
          ]
        }
      ]
    }
  },
  {
    "schema_version": 2,
    "id": "he-hds-open-treemap",
    "mode": "workflow",
    "tags": [
      "hds",
      "view",
      "executable",
      "natural"
    ],
    "utterance": "open Nvidia institutional ownership as a treemap",
    "resolved_entities": [
      {
        "spoken_name": "nvidia",
        "ticker": "NVDA",
        "venue": "US",
        "asset_class": "EQ"
      }
    ],
    "scoring": {
      "strict_steps": true,
      "actions": "exact"
    },
    "expected": {
      "kind": "execute",
      "steps": [
        {
          "command": "HDS",
          "ticker": "NVDA",
          "actions": [
            {
              "feature": "view",
              "operation": "select",
              "value": "Treemap"
            }
          ]
        }
      ]
    }
  },
  {
    "schema_version": 2,
    "id": "he-hds-open-bubble-noisy",
    "mode": "workflow",
    "tags": [
      "hds",
      "view",
      "executable",
      "noise"
    ],
    "utterance": "uh show me micro soft institushunal holders in the bub bull view",
    "resolved_entities": [
      {
        "spoken_name": "microsoft",
        "ticker": "MSFT",
        "venue": "US",
        "asset_class": "EQ"
      }
    ],
    "scoring": {
      "strict_steps": true,
      "actions": "exact"
    },
    "expected": {
      "kind": "execute",
      "steps": [
        {
          "command": "HDS",
          "ticker": "MSFT",
          "actions": [
            {
              "feature": "view",
              "operation": "select",
              "value": "Bubble"
            }
          ]
        }
      ]
    }
  },
  {
    "schema_version": 2,
    "id": "he-hds-followup-table",
    "mode": "workflow",
    "tags": [
      "hds",
      "view",
      "readiness-gap",
      "follow-up",
      "context"
    ],
    "utterance": "put this back in the table",
    "context": {
      "focused_panel": {
        "window_id": "hds-meta",
        "command": "HDS",
        "security": "META"
      }
    },
    "scoring": {
      "strict_steps": true,
      "actions": "exact"
    },
    "expected": {
      "kind": "execute",
      "steps": [
        {
          "step_kind": "configure",
          "configure_target": {
            "mode": "focused",
            "command": "HDS",
            "security": "META"
          },
          "actions": [
            {
              "feature": "view",
              "operation": "select",
              "value": "Table"
            }
          ]
        }
      ]
    }
  },
  {
    "schema_version": 2,
    "id": "he-hds-followup-treemap",
    "mode": "workflow",
    "tags": [
      "hds",
      "view",
      "executable",
      "follow-up",
      "context",
      "noise"
    ],
    "utterance": "switch that ownership thing to the tree map",
    "context": {
      "focused_panel": {
        "window_id": "hds-meta",
        "command": "HDS",
        "security": "META"
      }
    },
    "scoring": {
      "strict_steps": true,
      "actions": "exact"
    },
    "expected": {
      "kind": "execute",
      "steps": [
        {
          "step_kind": "configure",
          "configure_target": {
            "mode": "focused",
            "command": "HDS",
            "security": "META"
          },
          "actions": [
            {
              "feature": "view",
              "operation": "select",
              "value": "Treemap"
            }
          ]
        }
      ]
    }
  },
  {
    "schema_version": 2,
    "id": "he-hds-followup-bubble",
    "mode": "workflow",
    "tags": [
      "hds",
      "view",
      "executable",
      "follow-up",
      "context"
    ],
    "utterance": "make the holders window bubbles",
    "context": {
      "focused_panel": {
        "window_id": "hds-meta",
        "command": "HDS",
        "security": "META"
      }
    },
    "scoring": {
      "strict_steps": true,
      "actions": "exact"
    },
    "expected": {
      "kind": "execute",
      "steps": [
        {
          "step_kind": "configure",
          "configure_target": {
            "mode": "focused",
            "command": "HDS",
            "security": "META"
          },
          "actions": [
            {
              "feature": "view",
              "operation": "select",
              "value": "Bubble"
            }
          ]
        }
      ]
    }
  },
  {
    "schema_version": 2,
    "id": "he-hds-followup-explicit-company",
    "mode": "workflow",
    "tags": [
      "hds",
      "view",
      "executable",
      "follow-up",
      "entity"
    ],
    "utterance": "switch Meta institutional holders to bubbles",
    "resolved_entities": [
      {
        "spoken_name": "meta",
        "ticker": "META",
        "venue": "US",
        "asset_class": "EQ"
      }
    ],
    "context": {
      "focused_panel": {
        "window_id": "hds-meta",
        "command": "HDS",
        "security": "META"
      }
    },
    "scoring": {
      "strict_steps": true,
      "actions": "exact"
    },
    "expected": {
      "kind": "execute",
      "steps": [
        {
          "step_kind": "configure",
          "configure_target": {
            "mode": "command",
            "command": "HDS",
            "security": "META"
          },
          "actions": [
            {
              "feature": "view",
              "operation": "select",
              "value": "Bubble"
            }
          ]
        }
      ]
    }
  },
  {
    "schema_version": 2,
    "id": "he-hds-versus-hldr-who-owns",
    "mode": "workflow",
    "tags": [
      "hds",
      "disambiguation",
      "executable",
      "entity"
    ],
    "utterance": "who owns Berkshire show me the institutions holding the company not what Berkshire owns",
    "resolved_entities": [
      {
        "spoken_name": "berkshire",
        "ticker": "BRK.B",
        "venue": "US",
        "asset_class": "EQ"
      }
    ],
    "scoring": {
      "strict_steps": true,
      "actions": "exact"
    },
    "expected": {
      "kind": "execute",
      "steps": [
        {
          "command": "HDS",
          "ticker": "BRK.B"
        }
      ]
    }
  },
  {
    "schema_version": 2,
    "id": "he-hds-no-context-view",
    "mode": "workflow",
    "tags": [
      "hds",
      "view",
      "clarification",
      "context"
    ],
    "utterance": "make that a bubble view",
    "context": null,
    "scoring": {
      "strict_steps": true,
      "actions": "exact"
    },
    "expected": {
      "kind": "clarify",
      "clarification_contains": [
        "which",
        "holders",
        "window"
      ]
    }
  },
  {
    "schema_version": 2,
    "id": "he-eqs-run-followup",
    "mode": "workflow",
    "tags": [
      "eqs",
      "run-clear",
      "executable",
      "follow-up",
      "context"
    ],
    "utterance": "run the screener query",
    "context": {
      "focused_panel": {
        "window_id": "eqs",
        "command": "EQS",
        "security": null
      }
    },
    "scoring": {
      "strict_steps": true,
      "actions": "exact"
    },
    "expected": {
      "kind": "execute",
      "steps": [
        {
          "step_kind": "configure",
          "configure_target": {
            "mode": "focused",
            "command": "EQS",
            "security": null
          },
          "actions": [
            {
              "feature": "screen",
              "operation": "run",
              "value": null
            }
          ]
        }
      ]
    }
  },
  {
    "schema_version": 2,
    "id": "he-eqs-run-immediate",
    "mode": "workflow",
    "tags": [
      "eqs",
      "run-clear",
      "executable",
      "follow-up",
      "natural"
    ],
    "utterance": "run it",
    "context": {
      "focused_panel": {
        "window_id": "eqs",
        "command": "EQS",
        "security": null
      },
      "last_panel": {
        "window_id": "eqs",
        "command": "EQS",
        "security": null
      }
    },
    "scoring": {
      "strict_steps": true,
      "actions": "exact"
    },
    "expected": {
      "kind": "execute",
      "steps": [
        {
          "step_kind": "configure",
          "configure_target": {
            "mode": "focused",
            "command": "EQS",
            "security": null
          },
          "actions": [
            {
              "feature": "screen",
              "operation": "run",
              "value": null
            }
          ]
        }
      ]
    }
  },
  {
    "schema_version": 2,
    "id": "he-eqs-run-noisy",
    "mode": "workflow",
    "tags": [
      "eqs",
      "run-clear",
      "executable",
      "follow-up",
      "noise"
    ],
    "utterance": "okay apply teh screener results now",
    "context": {
      "focused_panel": {
        "window_id": "eqs",
        "command": "EQS",
        "security": null
      }
    },
    "scoring": {
      "strict_steps": true,
      "actions": "exact"
    },
    "expected": {
      "kind": "execute",
      "steps": [
        {
          "step_kind": "configure",
          "configure_target": {
            "mode": "focused",
            "command": "EQS",
            "security": null
          },
          "actions": [
            {
              "feature": "screen",